{
  "schema_version": "1.0",
  "trace_id": "trace_af001eb0a2a997f91e91ac6c",
  "task_id": "task_exploit-chain-20260910T170757Z-c2",
  "generated_at": "2026-09-10T18:51:16.983233+00:00",
  "status": "completed",
  "summary": "Analyzed 44 events and 2 alerts; 13 candidate paths. Evidence-based analysis, not confirmed attribution.",
  "initial_access_entity_id": null,
  "suspected_c2_entity_ids": [
    "c2_0c476cac567f475b16ee9b54"
  ],
  "attack_chain": [],
  "attribution": {
    "data_classification": [
      "real_exploitation"
    ],
    "method": "deterministic_evidence_correlation",
    "llm_used": false,
    "candidate_paths": [
      [
        "evt_84e4d338fda5a6e88d6f65b9",
        "evt_8fba0d6bf757e349a94ce142"
      ],
      [
        "evt_34ca78b3342a7895e36085c1",
        "evt_f5d8c82518fd5a0f0450c01c"
      ],
      [
        "evt_32bead3f752c758e54d9d7d7",
        "evt_be605b041f239f3fc8693ff8"
      ],
      [
        "evt_1ac8a0ba2d405c7a19e3c493",
        "evt_d7bae5721d190ecb2bc81731"
      ],
      [
        "evt_835f57180321a556e03cb22a",
        "evt_550f84046760fefe9b2d47c1"
      ],
      [
        "evt_f03cc4a2bf63f403884b8820",
        "evt_c75b8a6cf741a70f6f98d582"
      ],
      [
        "evt_e9bb91896b9feb496dcd1777",
        "evt_aa8cdb5d6c157fac4e60082d"
      ],
      [
        "evt_4a183f5f2c514dee690d6547",
        "evt_169916365bb3623266b4d6d7"
      ],
      [
        "evt_11b15dde0db52da776b84a94",
        "evt_4cf3311419f80c46e8323c6b"
      ],
      [
        "evt_b519c42694875e8fd03337ba",
        "evt_e153430d75a90ee4376eab4a"
      ],
      [
        "evt_f5e4f4973162903019f15553",
        "evt_402ec83a13f0d43e0c0c46a7"
      ],
      [
        "evt_2042f8141a9fa5e561a09f7a",
        "evt_df46ebf15e2ae34eeb7a1a6d"
      ],
      [
        "evt_6699b1cc517bcf05d4b9c108"
      ]
    ],
    "apt_similarity": [],
    "apt_similarity_scope": "primary_candidate_path_only",
    "path_analysis": {
      "lateral_movement": [
        {
          "source": "legacyweb01",
          "target": "process_491c1dc8348d00a96f634097",
          "timestamp": "2026-09-10T17:43:56+00:00",
          "confidence": 0.6,
          "evidence_event_ids": [
            "evt_6699b1cc517bcf05d4b9c108"
          ],
          "evidence_alert_ids": [
            "alert_95f2f749941595f103e4bbc6"
          ],
          "status": "alert_supported_candidate"
        }
      ],
      "privilege_escalation": [],
      "data_access": [],
      "data_exfiltration": []
    },
    "data_access_to_network_candidates": [],
    "stix_source": "runtime\\stix\\enterprise-attack.json",
    "limitations": [
      "Candidate relations do not prove common attacker identity.",
      "Only the strongest candidate path populates attack_chain; other paths remain separate.",
      "No live multi-agent LLM analysis is performed by this module.",
      "TTP similarity is not attribution; unobserved stages are not reconstructed."
    ]
  },
  "evidence_event_ids": [
    "evt_00ccc487561c4c6363b50914",
    "evt_0906cd8dd6e481fe82fa8db3",
    "evt_0e139445f1436519eece9dd5",
    "evt_0fbb90ce0fbe4f186b944698",
    "evt_11b15dde0db52da776b84a94",
    "evt_169916365bb3623266b4d6d7",
    "evt_1ac8a0ba2d405c7a19e3c493",
    "evt_2042f8141a9fa5e561a09f7a",
    "evt_211f597b0577e168592b22f2",
    "evt_25d73fb9854459f112a7eb51",
    "evt_32bead3f752c758e54d9d7d7",
    "evt_34ca78b3342a7895e36085c1",
    "evt_402ec83a13f0d43e0c0c46a7",
    "evt_48caf0593643a280c861f1a1",
    "evt_4a183f5f2c514dee690d6547",
    "evt_4cf3311419f80c46e8323c6b",
    "evt_550f84046760fefe9b2d47c1",
    "evt_5d23b2f2a8dd54e1c5d1203f",
    "evt_6129f5514bd409619f52f9aa",
    "evt_6699b1cc517bcf05d4b9c108",
    "evt_7cbfb3149ed11e2a4f64273e",
    "evt_835f57180321a556e03cb22a",
    "evt_84e4d338fda5a6e88d6f65b9",
    "evt_8dd063a22ff99fd8bc520932",
    "evt_8fba0d6bf757e349a94ce142",
    "evt_9d6b7de6469a3826a6a1f04f",
    "evt_9de2dfc28c826b85df4c4536",
    "evt_aa8cdb5d6c157fac4e60082d",
    "evt_b519c42694875e8fd03337ba",
    "evt_b9a9370656fcb3c333e29f68",
    "evt_bde54a1d3496e04e83268b40",
    "evt_be605b041f239f3fc8693ff8",
    "evt_c75b8a6cf741a70f6f98d582",
    "evt_c95ade491439516dbce72832",
    "evt_cfabc40689fdef0ea6e7a7a2",
    "evt_d7bae5721d190ecb2bc81731",
    "evt_df46ebf15e2ae34eeb7a1a6d",
    "evt_e153430d75a90ee4376eab4a",
    "evt_e5cfeb402b545c1659e7ebe8",
    "evt_e9bb91896b9feb496dcd1777",
    "evt_f03cc4a2bf63f403884b8820",
    "evt_f5d8c82518fd5a0f0450c01c",
    "evt_f5e4f4973162903019f15553",
    "evt_f729b461949a84fd62f26a8f"
  ],
  "evidence_alert_ids": [
    "alert_83068a59dfc1686d1938a3ee",
    "alert_95f2f749941595f103e4bbc6"
  ]
}