{
  "schema_version": "1.0",
  "trace_id": "trace_e0f8318efb079fdee2c5b484",
  "task_id": "task_exploit-chain-20260911T044921Z-c2",
  "generated_at": "2026-09-11T05:12:59.289920+00:00",
  "status": "completed",
  "summary": "Analyzed 89 events and 3 alerts; 17 candidate paths. Evidence-based analysis, not confirmed attribution.",
  "initial_access_entity_id": null,
  "suspected_c2_entity_ids": [
    "c2_4dfe8bae36552085cc73a8c6"
  ],
  "attack_chain": [],
  "attribution": {
    "data_classification": [
      "real_exploitation"
    ],
    "method": "deterministic_evidence_correlation",
    "llm_used": false,
    "candidate_paths": [
      [
        "evt_94ace1c6841e875939358eee",
        "evt_6f5594696fa7b814f705ce42"
      ],
      [
        "evt_12fdada45268e2cc8ea27050",
        "evt_d2fc989860708b65b83a9f77"
      ],
      [
        "evt_46b70f339246048e5ae50b5f",
        "evt_c0ccb57c9a063f2b1996d097"
      ],
      [
        "evt_e62a4f2878fd551ce6fdc3f2",
        "evt_dda3de7da5846b1a83688d08"
      ],
      [
        "evt_60c8d3052cc9146cbedeb3e1",
        "evt_04066852dbff5dbc568c381d"
      ],
      [
        "evt_dfdebaa347236ce49868a7cf",
        "evt_fa8fa14570db4da9c3bcc359"
      ],
      [
        "evt_e6e8922e7c8ebdc382d0a293",
        "evt_1f1f85ea766fdc6478265563"
      ],
      [
        "evt_d7de36a8933e749fbc79edd7",
        "evt_742b3ed1a6165894a98a8dd2"
      ],
      [
        "evt_c08d9b865eefb3b67336bfc7",
        "evt_348ef15bcd55f0499c4026b7"
      ],
      [
        "evt_1ca5fb933798cef0f6ac21b7",
        "evt_5751cb7b94aede16677a0ae1"
      ],
      [
        "evt_67737d4584064142692a0f08",
        "evt_474b36f376800b06ae50a503"
      ],
      [
        "evt_1433118425b7a592e22754ea"
      ],
      [
        "evt_9916cc64a69138fe22fae7b1"
      ],
      [
        "evt_676c6282038e70efefeab3a9"
      ],
      [
        "evt_dda65bd09911ba18681364fe"
      ],
      [
        "evt_f683515d5216102d273e6ec0"
      ],
      [
        "evt_ee6fb224f33c9371747c833c"
      ]
    ],
    "apt_similarity": [],
    "apt_similarity_scope": "primary_candidate_path_only",
    "path_analysis": {
      "lateral_movement": [
        {
          "source": "legacyweb01",
          "target": "process_51abce64259929db56e5e081",
          "timestamp": "2026-09-11T05:05:07+00:00",
          "confidence": 0.6,
          "evidence_event_ids": [
            "evt_676c6282038e70efefeab3a9"
          ],
          "evidence_alert_ids": [
            "alert_6d89d060c60d9ff73174192f"
          ],
          "status": "alert_supported_candidate"
        },
        {
          "source": "legacyweb01",
          "target": "process_9e81e89a1238bff7f31b2a34",
          "timestamp": "2026-09-11T05:05:07+00:00",
          "confidence": 0.6,
          "evidence_event_ids": [
            "evt_9916cc64a69138fe22fae7b1"
          ],
          "evidence_alert_ids": [
            "alert_6d89d060c60d9ff73174192f"
          ],
          "status": "alert_supported_candidate"
        },
        {
          "source": "legacyweb01",
          "target": "process_f6a15b4e57b420cac8c5ee5f",
          "timestamp": "2026-09-11T05:05:07+00:00",
          "confidence": 0.6,
          "evidence_event_ids": [
            "evt_dda65bd09911ba18681364fe"
          ],
          "evidence_alert_ids": [
            "alert_6d89d060c60d9ff73174192f"
          ],
          "status": "alert_supported_candidate"
        },
        {
          "source": "legacyweb01",
          "target": "process_ca6092ebc60ec8daf99b315e",
          "timestamp": "2026-09-11T05:05:07+00:00",
          "confidence": 0.6,
          "evidence_event_ids": [
            "evt_f683515d5216102d273e6ec0"
          ],
          "evidence_alert_ids": [
            "alert_6d89d060c60d9ff73174192f"
          ],
          "status": "alert_supported_candidate"
        }
      ],
      "privilege_escalation": [
        {
          "source": "user_41f18e3009f24abb1f3da335",
          "target": "process_c1ddc17ce0ccafcd9c63bd6f",
          "timestamp": "2026-09-11T05:05:07+00:00",
          "confidence": 0.6,
          "evidence_event_ids": [
            "evt_1433118425b7a592e22754ea"
          ],
          "evidence_alert_ids": [
            "alert_569d7922e39905fed74e20a7"
          ],
          "status": "alert_supported_candidate"
        },
        {
          "source": "user_41f18e3009f24abb1f3da335",
          "target": "process_5064fb65fa61b24a1fdf3a87",
          "timestamp": "2026-09-11T05:05:07+00:00",
          "confidence": 0.6,
          "evidence_event_ids": [
            "evt_ee6fb224f33c9371747c833c"
          ],
          "evidence_alert_ids": [
            "alert_569d7922e39905fed74e20a7"
          ],
          "status": "alert_supported_candidate"
        }
      ],
      "data_access": [],
      "data_exfiltration": []
    },
    "data_access_to_network_candidates": [],
    "stix_source": "runtime\\stix\\enterprise-attack.json",
    "limitations": [
      "Candidate relations do not prove common attacker identity.",
      "Only the strongest candidate path populates attack_chain; other paths remain separate.",
      "No live multi-agent LLM analysis is performed by this module.",
      "TTP similarity is not attribution; unobserved stages are not reconstructed."
    ]
  },
  "evidence_event_ids": [
    "evt_016d7d771eddb2ff57e941fe",
    "evt_04066852dbff5dbc568c381d",
    "evt_0b30e22f978d4637b2af6aeb",
    "evt_0f5c982c25e1f8018b694e11",
    "evt_114fb5ef452056f89d737833",
    "evt_12c4b25cbfa53493ca0795ec",
    "evt_12fdada45268e2cc8ea27050",
    "evt_139f8d6f44ed78a06961c827",
    "evt_1433118425b7a592e22754ea",
    "evt_1646279dbcf7c43b39350948",
    "evt_16fca8a636ca626a149c66c1",
    "evt_18e2adbb0a200c3a982140ee",
    "evt_193d2784fc00270830ceb95d",
    "evt_1abfc81ef7ad4d01941360c6",
    "evt_1ca5fb933798cef0f6ac21b7",
    "evt_1f1f85ea766fdc6478265563",
    "evt_2d2f4e1ded56e383c4afdb87",
    "evt_30ad8cfa98d25413e3d5e9b5",
    "evt_31fab32a21d3c74f1513fb99",
    "evt_348ef15bcd55f0499c4026b7",
    "evt_43b0f71c4de35c1231de2d5e",
    "evt_46b70f339246048e5ae50b5f",
    "evt_474b36f376800b06ae50a503",
    "evt_49780d4cd9932ef5ca15ce31",
    "evt_4a04d50b5c5870f663920d9a",
    "evt_4facab9ad20752b57c64c261",
    "evt_51384796f5f5d90262869aef",
    "evt_51c52b0e22c89448ac2138a8",
    "evt_525a647086ea7a7dd894e585",
    "evt_5490813ae89fa1ceb28be8c3",
    "evt_5751cb7b94aede16677a0ae1",
    "evt_59ba27c68f41572d50ac3d82",
    "evt_5dcb1bdf6e43dd6370c9ce74",
    "evt_60c8d3052cc9146cbedeb3e1",
    "evt_614dfa160e0aa1bff5959baa",
    "evt_648aca618bb62d6545f57e41",
    "evt_676c6282038e70efefeab3a9",
    "evt_67737d4584064142692a0f08",
    "evt_67b0d07f857104814dbe8fdc",
    "evt_69376d4052cfccf981d8b14b",
    "evt_6f5594696fa7b814f705ce42",
    "evt_72e04b3f8d4d6ecd1c3495c1",
    "evt_742b3ed1a6165894a98a8dd2",
    "evt_77b3ece9a71fcec8b73e5061",
    "evt_7997eb2853faf5e9affae111",
    "evt_7afba2bc61a5c9c0b487fba7",
    "evt_89589d2b8eb0e89312431e0b",
    "evt_8cd3ba87cc7212454260b188",
    "evt_91cbb551faec81a72db07601",
    "evt_94ace1c6841e875939358eee",
    "evt_9916cc64a69138fe22fae7b1",
    "evt_9b66439bc9417e8b623b1066",
    "evt_a36b783187d38e2b5dfed4d5",
    "evt_a36dcba4da62e99d3e3b4302",
    "evt_a4e6fef51f434eac23f3f71e",
    "evt_a4f80bd45e5c82bcd0c5c856",
    "evt_b2afb708e95e062adb66e344",
    "evt_b50909572a768412cb64936e",
    "evt_b9a8b8ecefad0fe8e47551cd",
    "evt_baf4e2cf5cd007efe1532344",
    "evt_be48d22039d4eb2b2554b768",
    "evt_c08d9b865eefb3b67336bfc7",
    "evt_c0ccb57c9a063f2b1996d097",
    "evt_c15272d63586cb490ad6be8d",
    "evt_c169bdb41c83d9693b134394",
    "evt_c253a44a975bbce3d296663c",
    "evt_c536e8f08e0166a4cb11f207",
    "evt_c5b5d336f25d204563d7d776",
    "evt_c60a56d6112a99d84e7ae71e",
    "evt_c650f871efb7b36c4a3327d7",
    "evt_c9edf70eb823b978aa917466",
    "evt_d2fc989860708b65b83a9f77",
    "evt_d6fe575533e4e9521839aee0",
    "evt_d7de36a8933e749fbc79edd7",
    "evt_dcdef7ccfa24b245cd136584",
    "evt_dda3de7da5846b1a83688d08",
    "evt_dda65bd09911ba18681364fe",
    "evt_ddbba1f6732aefef72f0eb60",
    "evt_dfdebaa347236ce49868a7cf",
    "evt_e172891bda5529d2e7fdf1ab",
    "evt_e1eaa15700eb5ce005c211fb",
    "evt_e59463f03b3d5fa22254b3ad",
    "evt_e62a4f2878fd551ce6fdc3f2",
    "evt_e6e8922e7c8ebdc382d0a293",
    "evt_ea38fab50009339737cd82c1",
    "evt_ee6fb224f33c9371747c833c",
    "evt_f0bb4c702f9c58de7018e869",
    "evt_f683515d5216102d273e6ec0",
    "evt_fa8fa14570db4da9c3bcc359"
  ],
  "evidence_alert_ids": [
    "alert_569d7922e39905fed74e20a7",
    "alert_6d89d060c60d9ff73174192f",
    "alert_820aa6343ab67d66ab140b2c"
  ]
}